{
  "schema": "pops.verification.provenance.v1",
  "case_id": "IF-01",
  "repository": "wolf75222/PoPS",
  "repository_sha": "0123456789abcdef0123456789abcdef01234567",
  "repository_dirty": false,
  "pops_version": "1.0.0",
  "component_catalog_digest": "0123456789abcdef0123456789abcdef0123456789abcdef0123456789abcdef",
  "native_header_signature": "1123456789abcdef0123456789abcdef0123456789abcdef0123456789abcdef",
  "native_variant_manifest_digest": "2123456789abcdef0123456789abcdef0123456789abcdef0123456789abcdef",
  "doctor_ok": true,
  "date_utc": "2026-08-17T00:00:00Z",
  "compiler": "GCC 13.x",
  "build_type": "Release",
  "precision": "float64",
  "pops_native_dim": 1,
  "kokkos_execution_space": "Serial",
  "mpi_enabled": false,
  "mpi_library": "none",
  "mpi_thread_level_requested": "MPI_THREAD_SINGLE",
  "mpi_thread_level_provided": "MPI_THREAD_SINGLE",
  "hdf5_collective_enabled": false,
  "nodes": 1,
  "mpi_ranks": 1,
  "omp_threads_per_rank": 1,
  "gpus": 0,
  "hostname": "fixture-host",
  "slurm_job_id": "fixture",
  "dimension": 1,
  "resolution": [
    32
  ],
  "block_size": [
    16
  ],
  "amr_total_levels": 1,
  "refinement_ratio": 2,
  "subcycling": false,
  "time_program": "SSPRK2",
  "cfl": 0.4,
  "final_time": 1.0
}
